categories,deal_features,merchant,mini_info,promotion_title,rel_location,state,total_ratings,url
"Local,Beauty & Spas,Face & Skin Care,Facial","What You'll Get,Giving this as a gift?,Send it instantly with one of our loving e-cards, or print a handy gift envelope and card.,$24 for an Anti-Aging Firming Facial ($60 Value),During the one-hour facial, a student aesthetician applies an anti-aging firming facial under the supervision of an expert instructor.",Christine Valmy International School,"Limited Time Remaining!,100+ viewed today,485 Ratings",$24 for an Anti-Aging Firming Facial at Christine Valmy International School NY ($60 Value),Midtown Manhattan,New York,485 Ratings,https://www.groupon.com/deals/christine-valmy-international-school-ny
"Local,Health & Fitness,Gyms,Fitness Classes","What You'll Get,Three Weeks of Unlimited Classes,During Hatha, Vinyasa, and YW signature flow,classes,, instructors lead students through a dynamic, demanding series of postures that hone alignment and concentration. Other stretching sessions include therapeutic Iyengar yoga, a prop-based style of yoga ideal for students recovering from injuries or those in chronic pain.,Though subscription to the service is not included with this voucher, students can access online yoga training videos at,myyogaworks.com,for an additional fee. A free 14-day trial is available for new subscribers.",YogaWorks,"Limited Time Remaining!,200+ viewed today,4,863 Ratings",$30 for Three Weeks of Unlimited Classes at YogaWorks ($100 Value),Multiple Locations,New York,"4,863 Ratings",https://www.groupon.com/deals/yogaworks-6-11
"Local,Health & Fitness,Natural Medicine,Acupuncture","What You'll Get,Choice of:,One 60-Minute Acupuncture Session,Two 60-Minute Acupuncture Sessions",The Healer's Way,"Limited Time Remaining!,40+ viewed today,5 Ratings",One or Two 60-Minute Acupuncture Sessions at The Healer's Way (Up to 71% Off),Midtown Manhattan,New York,5 Ratings,https://www.groupon.com/deals/the-healers-way-2
"Local,Automotive,Transportation,Bus","What You'll Get,The Deal,$25 for,round-trip transportation,to,Woodbury Premium Common outlets,and VIP coupon book ($42 value),Buses depart (Seven times a day) from the New York City Port Authority Bus Terminal.,Click here,to see departure times from New York as well as the departure times from the mall.,No Prior Reservation Required,Buses depart Port Authority Bus terminal at 7:15am, 8:30am, 9:30am, 10am, 11:30am, 12:35pm, and 2:45pm.,Buses depart Woodbury Premium Common outlets at 3:36pm, 4:10pm, 4:45pm, 5:21pm, 5:45pm, 6:15pm, 6:58pm, 8:16pm, and 9:26pm.",ShortLine/Coach USA,"Limited Time Remaining!,200+ bought today,1,587 Ratings",$25 for Round-Trip Service to Woodbury Common Premium Outlets from ShortLine/Coach USA ($42 Value),Short Line/Coach USA,New York,"1,587 Ratings",https://www.groupon.com/deals/shortline-coach-usa
"Local,Things To Do,Fun & Leisure,Art Classes","What You'll Get,After purchasing this deal, you will need to visit the website listed on your voucher to complete redemption.,Choose from Three Options,$20.50 for Paint and Drink Event for one ($40 value),$36.50 for Paint and Drink Event for two ($80 value),$67.50 for Paint and Drink Event for four ($160 value)",Paint Boire,"Limited Time Remaining!,700+ viewed today,860 Ratings","Paint and Drink Event for One, Two, or Four at Paint Boire (Up to 58% Off)",Multiple Locations,New York,860 Ratings,https://www.groupon.com/deals/paint-boire
"Local,Beauty & Spas,Nail Salons,No-Chip / Gel Mani Pedis","What You'll Get,Choose from Three Options,$28 for one regular mani-pedi (a $44 value),$29 for one gel manicure (a $45 value),$39 for a gel manicure and French pedicure (a $72 total value)",Natural Nail and Spa,"Limited Time Remaining!,100+ viewed today,1,102 Ratings",Mani-Pedis at Natural Nail and Spa (Up to 46% Off). Three Options Available.,Lenox Hill,New York,"1,102 Ratings",https://www.groupon.com/deals/bliss-natural-nail-spa
"Local,Beauty & Spas,Brows & Lashes,Eyelash Extensions","What You'll Get,Long lashes protect the eyes from irritants such as dust, wind, and looks of superiority from people with even longer eyelashes. Look lovely with this voucher.,Choose Between Two Options,$39 for a full set of basic eyelash extensions (7mm to 10mm) (a $120 value),$49 for a full set of Glam or 4D eyelash extensions (7mm to 18mm) (a $180 value),Technicians create a fuller, darker lash line by bonding individual extensions to natural lashes using a semipermanent adhesive. Basic sets include 70–85 lashes per eye; Glam and 4D sets include 110 lashes per eye.,Tax and tip will be collected at end of appointment based off retail price.",Candy Spa ,"Limited Time Remaining!,Selling fast!,930 Ratings","Full Set of Basic, Glam, or 4D Eyelash Extensions at Candy Spa (Up to 73% Off)",Candy Spa,New York,930 Ratings,https://www.groupon.com/deals/candy-spa-5
"Local,Beauty & Spas,Salons,Hair Salons","What You'll Get,Some people use mirrors to make sure every hair is in place, whereas others use mirrors to make it look like they own more birds than they really do. Reflect on a new style with this voucher.,Choose from Three Options,$39 for a wash, cut, and style up to director level (up to an $85 value) and a Moroccanoil treatment (a $35 value; up to a $120 total value),$69 for a wash, cut, and style up to director level (up to an $85 value), single-process touch-up (a $65 value), and a Moroccanoil treatment (a $35 value; up to a $205 total value),$79 for a wash, cut, and style up to director level (up to an $85 value) and partial highlights (up to a $95 value; up to a $180 value)",Lifestyle Salon NYC,"Limited Time Remaining!,150+ viewed today,549 Ratings",Haircut and Moroccanoil Treatment with Optional Color or Cut and Highlights at Lifestyle Salon NYC (Up to 68% Off),Lifestyle Salon NYC,New York,549 Ratings,https://www.groupon.com/deals/lifestyle-salon-nyc-2
"Local,Food & Drink,Restaurants,Mexican Restaurants","What You'll Get,The Deal,How to use this deal:,Claim this deal by linking it to your eligible credit cards,Pay for qualifying purchases at the merchant with a linked card,Get 30% cash back on your first purchase and 10% cash back on additional purchases, including if the deal is re-claimed,Cash back rewards will be credited to your card statement within a few days",Serenata Restaurant & Bar,"1st Purchase 30% Cash Back,10% Cash Back After That,No Voucher to Present,491 Ratings",30% Cash Back at Serenata Restaurant & Bar,Serenata Restaurant & Bar,New York,491 Ratings,https://www.groupon.com/deals/serenata-restaurant-bar-6
"Local,Beauty & Spas,Brows & Lashes,Eyelash Extensions","What You'll Get,Choice of:,Full Set of Mink Eyelash Extensions,Full Set of Mink Eyelash Extensions with a Two Week Fill,Full Set of Silk Eyelash Extensions,Full Set of Volume Silk Eyelash Extensions",Barbi Eyelashes,"Limited Time Remaining!,60+ viewed today,100 Ratings",Full Set of Mink or Silk Eyelash Extensions with Optional Two Week Fill at Barbi Eyelashes (Up to 50% Off),New York,New York,100 Ratings,https://www.groupon.com/deals/barbi-eyelashes-1
"Local,Beauty & Spas,Hair Removal,Waxing","What You'll Get,Choose from Three Options,$25 for one Brazilian wax ($60 value),$69 for three Brazilian waxes ($180 value),$20 for $40 worth of waxing services,All waxing services use Natural Bee’s Brazilian Wax.",Queen Jane Day Spa,"Limited Time Remaining!,10+ viewed today,1,793 Ratings",One or Three Brazilian Waxes or Waxing Services at Queen Jane Day Spa (Up to 62% Off),Queen Jane Day Spa,New York,"1,793 Ratings",https://www.groupon.com/deals/queen-jane-day-spa-1-9
"Local,Food & Drink,Restaurants,American Restaurants","What You'll Get,The Deal,How to use this deal:,Claim this deal by linking it to your eligible credit cards,Pay for qualifying purchases at the merchant with a linked card,Get 25% cash back on your first purchase and 10% cash back on additional purchases, including if the deal is re-claimed,Cash back rewards will be credited to your card statement within a few days",New York Dog House,"Pay Nothing to Claim,No Voucher to Present,492 Ratings",25% Cash Back at New York Dog House,Astoria,New York,492 Ratings,https://www.groupon.com/deals/new-york-dog-house-4
"Local,Beauty & Spas,Brows & Lashes,Eyelash Extensions","What You'll Get,One Full Set of Eyelash Extensions,Working hours:,11:00 am - 8:00 pm,Monday - Saturday",Blink Lash Club,"Limited Time Remaining!,20+ viewed today,65 Ratings",One Full Set of Eyelash Extensions at Blink Lash Club (56% Off),Midtown Manhattan,New York,65 Ratings,https://www.groupon.com/deals/blink-lash-club-1
"Local,Food & Drink,Restaurants,Italian Restaurants","What You'll Get,Choice of:,$25 Value for Lunch for Two or More People, Valid Monday–Friday,$50 Value for Dinner for Two or More People, Valid Sunday–Thursday,$50 Value for Dinner for Two or More People, Valid Any Day,$100 Value for Dinner for Four or More People, Valid Sunday–Thursday,$100 Value for Dinner for Four or More People, Valid Any Day,See the,lunch,and,dinner,menu.",The Cake Lounge & Restaurant,"Limited Time Remaining!,80+ viewed today,677 Ratings","Italian Lunch or Dinner for Two, Four, or More at The Cake Lounge & Restaurant (Up to 45% Off)",North End,New York,677 Ratings,https://www.groupon.com/deals/the-cake-lounge-restaurant-3
"Local,Personal Services,Photography,Photographers","What You'll Get,Choice of:,Family Photo Shoot with Three Portrait Sheets and One Wall Print ($134 value),In-studio photo shoot,Three portrait sheets of one pose (two 5”x7” prints, five 4”x6” prints, and eight wallet-sized prints),One 12”x24” wall print (made of two images),One free shareable digital image emailed to you after your session,Special discount on a high-resolution CD of all session images,Family Photo Shoot with Six Portrait Sheets and One Wall Print ($218 value),In-studio photo shoot,Six portrait sheets of one pose (one 8”x10” print, four 5”x7” prints, ten 4”x6” prints, eight wallet-sized prints),One 12”x24” wall print (made of three images),Unlimited tonal enhancement,One free shareable digital image emailed to you after your session,Special discount on a high-resolution CD of all session images,Family Photo Shoot with Eight Portrait Sheets and One Wall Print ($296 value),In-studio photo shoot,Eight portrait sheets of two poses (mix and match print sizes up to 8”x10”),One wall print (made of 1–5 images; available in sizes up to 16”x20”),One 8”x10” silhouette pose,One digital image,Unlimited tonal enhancement,One free shareable digital image emailed to you after your session,Special discount on a high-resolution CD of all session images",Picture People,"Limited Time Remaining!,Selling fast!,72,740 Ratings","In-Studio Family Photo Shoot with Three, Six, or Eight Portrait Sheets at Picture People (Up to 89% Off)",Multiple Locations,New York,"72,740 Ratings",https://www.groupon.com/deals/picture-people-557-north-jersey
"Local,Beauty & Spas,Brows & Lashes","What You'll Get,The Deal,$19 for eyebrow tweezing ($40 value)",Brows by Sebastian NYC,"Limited Time Remaining!,10+ viewed today,70 Ratings",$19 for Eyebrow Tweezing at Brows by Sebastian NYC ($40 Value),Midtown,New York,70 Ratings,https://www.groupon.com/deals/sebastian-makeup-1
"Local,Beauty & Spas,Massage,Hot Stone Massage","What You'll Get,Choose Between Two Options,$45 for one 60-minute hot-stone massage ($78 value),$85 for two 60-minute hot-stone massages ($156 value)",Eastern Health Connection Plus,"Limited Time Remaining!,Up to 46% Off,255 Ratings",One or Two 60-Minute Hot-Stone Massages at Eastern Health Connection Plus (Up to 46% Off),Eastern Health Connection Plus INC.,New York,255 Ratings,https://www.groupon.com/deals/eastern-health-connection-plus-inc-1
"Local,Food & Drink,Restaurants,Burgers","What You'll Get,The Deal,How to use this deal:,Claim this deal by linking it to your eligible credit cards,Pay for qualifying purchases at the merchant with a linked card,Get 20% cash back on your first purchase and 10% cash back on additional purchases, including if the deal is re-claimed,Cash back rewards will be credited to your card statement within a few days",Paul's Da Burger Joint,"Pay Nothing to Claim,No Voucher to Present,7 Ratings",20% Cash Back at Paul's Da Burger Joint,East Village,New York,7 Ratings,https://www.groupon.com/deals/pauls-da-burger-joint
"Local,Beauty & Spas,Face & Skin Care,Facial","What You'll Get,Choice of:,One Berry Blonde Signature Facial with Collagen Mask and Scalp Massage,Three Berry Blonde Signature Facials with Collagen Masks and Scalp Massages,Five Berry Blonde Signature Facials with Collagen Masks and Scalp Massages",Berry Blonde Spa,"Limited Time Remaining!,Up to 73% Off,173 Ratings","One, Three, or Five Facials with Collagen Masks and Scalp Massages at Berry Blonde Spa (Up to 73% Off)",New York,New York,173 Ratings,https://www.groupon.com/deals/berry-blonde-spa-9
"Local,Beauty & Spas,Massage,Swedish Massage","What You'll Get,Getting a massage is an effective way to relax, much like dipping your feet into a warm box of puppies. Immerse yourself in comfort with this Groupon.,Choose from Four Options,One 50-Minute Swedish Massage with Aromatherapy,Three 50-Minute Swedish Massages,One 50-Minute Deep-Tissue Massage with Aromatherapy,Three 50-Minute Deep-Tissue Massages,Skin Spa New York’s,Swedish massage,is designed to relieve stress using medium pressure, long, gliding strokes, and kneading. During each 50-minute session, an expert therapist customizes your treatment to focus on areas of concern, helping to ease tension and alleviate aches throughout the body. The 50-minute,deep-tissue massage,works more firmly into muscles with strong pressure and slow strokes. Aromatherapy complements both types of massage with ESS essential oils that may alleviate the effects of sleep deprivation and anxiety.,The 60-minute appointment includes changing time in the massage room and a 50-minute massage, so Skin Spa New York advises arriving at least 10 minutes early to maximize the relaxation potential of your experience. This deal is valid for both new and existing clients. Male and female massage therapists are available.,Click here to book appointments online,Valid at six Manhattan Skin Spa New York locations:,Midtown: 44th Street between Madison and Fifth Avenues,Flatiron/Chelsea: 21st Street between Fifth and Sixth Avenues,SoHo: Broadway between Spring and Broome Streets,Midtown East/Murray Hill: Lexington Ave, entrance on 40th Street,Fashion District: 37th Street at Eighth Avenue,Midtown West/57 Street: 57th Street between Sixth and Seventh Avenues,View Skin Spa New York’s other offers:,Corrective Facials,Organic Spray Tans,Brazilian Waxes,Anti-Aging Laser Facials,Swedish Massage with Customized Facials,Customized Facial, Microdermabrasion, or Power Peel,Laser Hair Removal",Skin Spa New York,"Limited Time Remaining!,100+ viewed today,4,661 Ratings",One or Three Swedish or Deep-Tissue Massages at Skin Spa New York (Up to 47% Off),Multiple Locations,New York,"4,661 Ratings",https://www.groupon.com/deals/skin-spa-2-91169
"Local,Beauty & Spas,Salons,Hair Salons","What You'll Get,Choice of:,Haircut and Blowdry,Single Process Color, Hair Cut, Shampoo, Deep Conditioning, and Blowout,Half Head of Highlights, Hair Cut, Shampoo, Deep Conditioning, and Blowout",Davidov Hair and Spa,"Limited Time Remaining!,30+ viewed today,772 Ratings",Hair Packages at Davidov Hair and Spa (Up to 65% Off ). Three Options Available.,Midtown Manhattan,New York,772 Ratings,https://www.groupon.com/deals/davidov-hair-and-spa-2-5
"Local,Beauty & Spas,Salons,Hair Salons","What You'll Get,Choice of:,Cut, Shampoo, Style, and Karastate Hair Treatment,Cut, Shampoo, Style, Kerastate Hair Treatment, and Full Highlight,Cut, Shampoo, Style, Kerastate Hair Treatment, and Balayage or Hombre,All options are valid toward certain Master Stylists.",Luxe Den Spa,"Limited Time Remaining!,80+ viewed today,460 Ratings",Hair Styling Services at Luxe Den Spa (Up to 54% Off). Three Options Available.,Luxe Den Spa,New York,460 Ratings,https://www.groupon.com/deals/luxe-den-spa-3
"Local,Health & Fitness,Gyms,Fitness Classes","What You'll Get,Choice of:,Three Kickboxing Classes with Gloves,Six Kickboxing Classes with Gloves",CKO Kickboxing,"Limited Time Remaining!,Up to 78% Off,111 Ratings",Three or Six Kickboxing Classes with Gloves at CKO Kickboxing (Up to 78% Off),Jersey City,New York,111 Ratings,https://www.groupon.com/deals/cko-kickboxing-jersey-city-1
"Local,Beauty & Spas,Hair Removal,Waxing","What You'll Get,Every local community has a story, a history, and a unique personality that cannot be replicated. This is often thanks to specialized, small-scale businesses, like this one, which contribute to a neighborhood’s distinctive character and promote a thriving ecosystem in their community. Small, independent businesses offer diverse products and services, fostering economic resilience by removing the local economy’s dependence on a single industry. When you buy local, you build local, and deepen your connection to your own community.,As a result, patronizing a local business like this is an act of community building. Check out their website to learn more about the local experience you can discover today.,Did You Know?,48 cents of every dollar spent at a locally owned retail business goes back into the local community. That’s more than three times the amount that local economies recover from chain retailers —,Civic Economics’ 2012 survey of local businesses,Local businesses have generated 65% of the country’s net new jobs over the past 17 years —,US Small Business Administration",Lady Care Beauty Salon,"Limited Time Remaining!,Up to 50% Off,21 Ratings",$20 voucher for Brazilian Wax at Lady Care Beauty Salon,Rego Park,New York,21 Ratings,https://www.groupon.com/deals/lady-care-beauty-salon-1
"Local,Food & Drink,Restaurants,Italian Restaurants","What You'll Get,The Deal,How to use this deal:,Claim this deal by linking it to your eligible credit cards,Pay for qualifying purchases at the merchant with a linked card,Get 20% cash back on your first purchase and 10% cash back on additional purchases, including if the deal is re-claimed,Cash back rewards will be credited to your card statement within a few days",Market Cafe & Brick Oven Pizza ,"Pay Nothing to Claim,No Voucher to Present,2 Ratings",20% Cash Back at Market Cafe & Brick Oven Pizza,Midtown East,New York,2 Ratings,https://www.groupon.com/deals/market-cafe-4
"Local,Beauty & Spas,Massage,Full Body Massage","What You'll Get,Choice of:,One 60-Minute Full Body or Reflexology and Legs Massage,One Hydrating 60-Minute Full Body or Reflexology and Legs Massage with Cellulite Reduction,One 60-Minute 7-Oils Slimming Full-Body Lymphatic Massage,Massage Pressure: How Much Can You Handle?,A good massage is all about communication, and your therapist will want to know how much pressure to apply. Use our guide to make the most of your upcoming session.,A massage can already be a vulnerable experience, so the question of how much pressure the therapist should apply can be tough to answer, especially given that everyone experiences pressure differently. Fortunately, there are basically three possible responses—light, medium, or firm—and considering the following factors may help you decide:,Pain Tolerance:,If you find yourself extremely sensitive to touch, request light pressure. Likewise, people who can tolerate rigorous—possibly even uncomfortable—pressure should choose firm to get the most out of the muscle manipulation. Always trust your body; if firm pressure feels too intense, ask the therapist to ease up.,Why Are You Here?:,If your top priority is relaxation, then light or medium pressure is for you. If you want to work out knots, relieve concentrated tension, or pop the balloon animal you swallowed, then firm pressure may be required. If you’re looking for a mix of outcomes, explain them in detail, pointing out specific areas and desired results. For instance, you might say, “I want to loosen my back muscles but break up knots in my shoulders,” each of which requires a different amount of pressure.,Don’t Sweat It:,Massage therapy is designed to improve the body’s overall function, whether by promoting relaxation or relieving aches and pains. So even if you choose a pressure level at the start of a massage, you’re not locked into it—you can request lighter or firmer pressure at any point during treatment. Good massage therapists appreciate and respond to feedback, which helps them develop personalized sessions that feel good and fulfill your expectations.",Stellar Fitness Spa,"Limited Time Remaining!,Up to 61% Off,6 Ratings",Full-Body Massage or Reflexology at Stellar Fitness Spa (Up to 61% Off). Three Options Available.,Midtown Manhattan,New York,6 Ratings,https://www.groupon.com/deals/stellar-fitness-spa-1
"Local,Beauty & Spas,Hair Removal,Brazilian Wax","What You'll Get,Choice Of:,One Brazilian Sugaring Wax,Three Brazilian Sugaring Waxes,Body Hair: Getting to the Root,Body hair can be unsightly, but it’s all part of a natural process. Read on for a basic overview of this stubborn foe.,Follicle,: the part of the skin that anchors an individual shaft of hair. Each follicle consists of a sebaceous gland, which secretes oil (sebum) to condition the hair and skin, and a few nerve endings at the base that allow hair to carry out one of its main functions: to act as a sensitive touch receptor.,Growth cycles,: during the initial phase of the hair-growth cycle,,anagen,, strands grow up to 0.2 mm per day. This is followed by a,catagen,phase, which lasts two–three weeks, then a,telogen,phase in which hair stops growing. Individual follicles may be at different stages of the cycle at any given time.,Epilation,: the removal of hair from the root. Common methods include tweezing, waxing, laser hair removal, and stapling a tiny eviction notice to every follicle.,Depilation,: the removal of hair from above the skin, usually via shaving or depilation creams, which evolved in the 1930s from formulas used to remove hair from cattle hides.,Jazz bikinis,: the common term for the short skirts worn by flappers in the 1920s—a trend often attributed to the rise of leg shaving as a popular routine.",Excellent Brows,"Limited Time Remaining!,Up to 56% Off,4 Ratings",One or Three Brazilian Sugaring Waxes at Excellent Brows (Up to 56% Off),Midtown Manhattan,New York,4 Ratings,https://www.groupon.com/deals/excellent-brows
"Local,Beauty & Spas,Brows & Lashes,Eyelash Extensions","What You'll Get,Choose between the Two Options,$75 for a full set of natural eyelash extensions ($150 value),$99 for a full set of natural eyelash extensions with one fill-in ($230 value),Eyelash Extensions: Window Dressing for the Soul,Eyelid-enhancing
 lash extensions create a lush look. Learn what to expect with Groupon’s
 exploration of these eyelash impostors.,The first modern false 
eyelashes were made from human hair, commissioned by silent-film 
director D. W. Griffith so that his starlet’s lashes would touch her 
cheeks with every soulful downward gaze. Although you may think it’d be 
hard to improve on these natural materials, in reality, the difference 
in texture between eyelashes and the stuff that grows from the head 
would make such extensions look a little strange. Stick-on strips have 
been available in drugstores for decades, but it wasn’t until the 
mid-2000s that cosmetic scientists developed semipermanent extensions. 
Also known as grafted lashes, these delicate fibers fuse to the top of 
pre-existing lashes with pharmaceutical-grade glue, lending eyes a lush,
 natural-looking fringe without the use of mascara.,As clients 
lie on a table with their eyes shut, a professional applies artificial 
lashes strand by strand, carefully bonding them about a millimeter away 
from the eyelid to avoid any contact with the skin or eye. The look 
stays intact for about two to six weeks—natural eyelashes have a finite 
lifespan, and when they fall out, they take the extensions with them.,Lash
 extensions generally come in two varieties: mink and synthetic. Mink 
extensions are made from sanitized, hypoallergenic hairs collected by 
brushing live mink, the same petite carnivores whose famously soft fur 
is prized for a variety of other applications. For synthetic extensions,
 lab technicians replicate the look and feel of natural hairs by forging
 lashes from plastic, faux-mink poly fibers, silk blends, or 
high-quality keraspecific fibers, which are chemically identical to real
 human hair. No matter the material, extensions should feel comfortable 
and light as they frame what poets have long called “the windows to the 
soul” and “the worst part of the face to be poked in.”",Curvy Lashes,"Limited Time Remaining!,Up to 57% Off,33 Ratings",Eyelash Extensions at Curvy Lashes (Up to 57% Off). Two Options Available.,Midtown Manhattan,New York,33 Ratings,https://www.groupon.com/deals/curvy-lashes
