categories,deal_features,merchant,mini_info,promotion_title,rel_location,state,total_ratings,url
"Local,Home Services,Interior Design,Interior Painting","What You'll Get,Choose From Three Options,$12 for Paint, Hardware and Home Supplies,$27 for Paint, Hardware and Home Supplies,$50 for Paint, Hardware and Home Supplies,Working Hours:,Weekdays: 7:30 a.m. to 8 p.m.,Saturday: 9 a.m. to 5 p.m.,Sunday: 11 a.m. to 5 p.m.,A Chat with Beacon Paint & Hardware,What services does your business offer and what makes your business stand out from the competition?,Beacon is more than just another hardware store. Dedicated to the neighborhood, customer service is our first priority. We love giving balloons to kids and treats to dogs. We got top grades from the Zagat Shopping Guide, and have won numerous awards!,Of the products you sell, which are your favorites?,Benjamin Moore Paints; paint sundries; small and large hardware items; hand and power tools; light bulbs; electrical supplies; building materials; heaters; snow melt; fans; air conditioners; cleaning supplies; and more! We rent tools, and we cut keys and repair lamps.,What was the inspiration to start or run this business?,Beacon was founded around 1900. It started as Beacon Paint & Varnish Co., later Beacon Paint & Wallpaper, and later to its current name. The store originally was on the West side of Amsterdam Avenue. Around 1940, Beacon relocated to its present location, which used to be home of an A&P supermarket.,What do you love most about your job?,Interacting with our regulars and making new friends. Being able to help people, especially when true customer service is so lacking these days, is very rewarding.",Beacon Paint & Hardware,"Limited Time Remaining!,10+ viewed today,54 Ratings","Up to 50% Off Paint, Hardware and Home Supply at Beacon Paint & Hardware",Upper West Side,New York,54 Ratings,https://www.groupon.com/deals/beacon-paint-hardware
"Local,Personal Services,Electronics Repair,Phone Repair","What You'll Get,Choice of:,iPhone 5/5C/5S Glass Screen Repair,iPhone 6 Glass Screen Repair,iPhone 6 Plus Glass Screen Repair,iPhone 6s Glass Screen Repair,iPhone 6s Plus Glass Screen Repair,iPhone 7 Glass Screen Repair,iPhone 7 Plus Glass Screen Repair,iPhone 5/6 Battery Replacement",KB Network,"Limited Time Remaining!,150+ viewed today,506 Ratings",iPhone Glass Repair or iPhone 5/6 Battery Replacement at KB Network (Up to 40% Off),Midtown Manhattan,New York,506 Ratings,https://www.groupon.com/deals/kb-network-4
"Local,Beauty & Spas,Massage","What You'll Get,Like the hand inside a sock puppet, the spine supports the body’s every motion and keeps it from collapsing into a formless sack. Shape up with this voucher.,$29 for Chiropractic Package ($325 Value),Exam and spinal adjustment (a $225 value),60-minute massage (a $100 value)<p>",Alive & Well Chiropractic,"Limited Time Remaining!,30+ viewed today,644 Ratings",$29 for a Chiropractic Package with 60-Minute Massage,Alive & Well Chiropractic,New York,644 Ratings,https://www.groupon.com/deals/alive-well-chiropractic
"Local,Things To Do,Sightseeing & Tours,Boat Tours","What You'll Get,Choose From Four Options,$17 for a 75-minute Downtown Liberty cruise for one, valid any day ($27 value),$29 for a 75-minute Downtown Liberty cruise for two, valid any day ($54 value),$14 for a 75-minute Downtown Liberty cruise for one, valid Monday-Thursday ($27 value),$25 for a 75-minute Downtown Liberty cruise for two, valid Monday-Thursday ($54 value),Tours run every day, departing from Pier 36 at 12:30 pm, 2:00 pm, 3:30 pm everyday; check the,schedule,for more information.",New York Water Tours,"Limited Time Remaining!,850+ viewed today,4,144 Ratings",Downtown Liberty Cruise for One or Two with New York Water Tours (Up to 54% Off),Pier 36,New York,"4,144 Ratings",https://www.groupon.com/deals/new-york-water-tours
"Local,Health & Fitness,Dental,Dentist","What You'll Get,Like a pet tiger, a gleaming smile can impress friends, make enemies jealous, and allow one to effortlessly move past club bouncers. Get nonfeline special treatment with this voucher.,Choose from Three Options,$39 for a basic dental package (a $395 total value),A dental exam (a $75 value),Digital x-rays (a $95 value),A teeth cleaning (a $150 value),An,Invisalign,consultation (a $75 value),$2,000 off a future Invisalign treatment,$129 for a Zoom teeth-whitening package (an $874 total value),A 90-minute,Zoom,teeth-whitening treatment (a $799 value),An Invisalign consultation (a $75 value),$2,000 off a future Invisalign treatment,$159 for a complete dental package (a $1,194 total value),A dental exam (a $75 value),Digital x-rays (a $95 value),A teeth cleaning (a $150 value),An Invisalign consultation (a $75 value),A 90-minute Zoom teeth-whitening treatment (a $799 value),$2,000 off a future Invisalign treatment",Smile Cafe,"Limited Time Remaining!,50+ viewed today,211 Ratings","Dental-Exam Package, Teeth-Whitening Package, or Combined Package at Smile Cafe (Up to 90% Off)",Murray Hill,New York,211 Ratings,https://www.groupon.com/deals/smile-cafe-2
"Local,Health & Fitness,Gyms,Fitness Classes","What You'll Get,Choose Between Two Options,$39 for 10 yoga classes ($120 value),$35 for one month of unlimited yoga classes ($130 value)",Three Jewels Outreach Center,"Limited Time Remaining!,30+ viewed today,39 Ratings",Up to 73% Off Yoga Classes at Three Jewels Outreach Center,Downtown Manhattan,New York,39 Ratings,https://www.groupon.com/deals/three-jewels-outreach-center-1
"Local,Beauty & Spas,Hair Removal,Waxing","What You'll Get,Choice of:,Brazilian Waxing,Three Brazilian Waxings,Two Eyebrow Threadings or Waxes,Brazilian Wax and Eyebrow Threading or Wax,Three Brazilian Wax and Eyebrow Threading or Wax
####Body Hair: Getting to the Root,Body hair can be unsightly, but it’s all part of a natural process. Read on for a basic overview of this stubborn foe.,Follicle,: the part of the skin that anchors an individual shaft of hair. Each follicle consists of a sebaceous gland, which secretes oil (sebum) to condition the hair and skin, and a few nerve endings at the base that allow hair to carry out one of its main functions: to act as a sensitive touch receptor.,Growth cycles,: during the initial phase of the hair-growth cycle,,anagen,, strands grow up to 0.2 mm per day. This is followed by a,catagen,phase, which lasts two–three weeks, then a,telogen,phase in which hair stops growing. Individual follicles may be at different stages of the cycle at any given time.,Epilation,: the removal of hair from the root. Common methods include tweezing, waxing, laser hair removal, and stapling a tiny eviction notice to every follicle.,Depilation,: the removal of hair from above the skin, usually via shaving or depilation creams, which evolved in the 1930s from formulas used to remove hair from cattle hides.,Jazz bikinis,: the common term for the short skirts worn by flappers in the 1920s—a trend often attributed to the rise of leg shaving as a popular routine.",Unique Threading Salon,"Limited Time Remaining!,30+ viewed today,16 Ratings",Brazilian or Eyebrow Wax or Eyebrow Threading at Unique Threading Salon (Up to 51% Off),Midtown Manhattan,New York,16 Ratings,https://www.groupon.com/deals/unique-threading-salon-1-3
"Local,Beauty & Spas,Massage","What You'll Get,Choose from Three Options,$35 for one 60-minute therapeutic massage or hot stone therapy massage ($70 value),$49 for one 60-minute therapeutic massage and 30-minute foot reflexology ($110 value),$55 for one 90-minute massage ($110 value)",Four Seasons Spa,"Limited Time Remaining!,Selling fast!,478 Ratings","60-Minute Hot Stone Massage with Optional Reflexology, or 90-Minute Massage at Four Seasons Spa (Up to 55% Off)",Four Seasons Spa,New York,478 Ratings,https://www.groupon.com/deals/four-seasons-spa-1-1
"Local,Health & Fitness,Gyms,Fitness Classes","What You'll Get,Choose from Three Options,$30 for two pole-dancing and sexy-fitness classes ($70 value),$65 for five pole-dancing and sexy-fitness classes ($125 value),$109 for ten pole-dancing and sexy-fitness classes ($200 value),Click,here,to view the class schedule.,Pole Fitness: Seductive Strength,Pole fitness is both an art form and an athletic discipline. Prepare to give it a spin by reading Groupon’s brief introduction.,If certain members of the International Pole Dance Fitness Association have their way and pole dancing becomes an official Olympic sport, it won’t be without good reason. The pastime employs the same level of stamina, coordination, and flexibility found in other notable Olympic disciplines. As a combination of gymnastic movements and dance, pole fitness acts as both an anaerobic and aerobic workout: proficient dancers twist, climb, and glissade around poles, supporting and controlling their own body weight with a seemingly effortless grace. The men and women who practice pole dancing on a regular basis often report improvement not just in strength, but also self-confidence and body image.,Although once pegged as a controversial erotic performance art, pole dancing has rapidly blossomed into an internationally respected form of fitness, boasting more than 500 studios in the United States alone. Even without a slot on the Olympic schedule of events, practitioners of the demanding exercise genre perform at amateur and professional competitions throughout the world each year.",Femme Body Fitness,"Limited Time Remaining!,100+ viewed today,429 Ratings","Two, Five, or Ten Pole-Dancing and Sexy-Fitness Classes at Femme Body Fitness (Up to 57% Off)",Midtown Manhattan,New York,429 Ratings,https://www.groupon.com/deals/femme-body-fitness
"Local,Things To Do,Kids Activities,Kids Sports","What You'll Get,Choice of:,Two Bowling Games for Two People with Shoe Rental,Two Bowling Games for Four People with Shoe Rental,Two Bowling Games for Six People with Shoe Rental",Bowl 360,"Limited Time Remaining!,300+ viewed today,1,725 Ratings","Two Games of Bowling with Shoe Rental for Two, Four, or Six at Bowl 360 (Up to 44% Off)",Ozone Park,New York,"1,725 Ratings",https://www.groupon.com/deals/bowl-360-1
"Local,Beauty & Spas,Brows & Lashes,Eyebrow Threading","What You'll Get,Hair removal can be difficult, especially the residual patches left over from your past life as a badger. Clear things up with this voucher.,Choose from Three Options,$7 for two eyebrow-threading sessions (a $14 value),$14 for four eyebrow-threading sessions (a $28 value),$16 for one eyebrow-threading session (a $7 value) and one full-face-threading session (a $25 value; a $32 total value)",Classic Brows,"Limited Time Remaining!,10+ viewed today,212 Ratings",Two or Four Eyebrow-Threading Sessions or One Eyebrow and Full-Face Threading at Classic Brows (50% Off),Manhattan,New York,212 Ratings,https://www.groupon.com/deals/perfect-look-threading-salon
"Local,Health & Fitness,Gyms,Zumba","What You'll Get,Choice of:,One Zumba Class,Three Zumba Class,Six Zumba Classes",Z Club NY,"Limited Time Remaining!,40+ viewed today,36 Ratings","One, Three, or Six Zumba Classes at Z Club NY (Up to 51% Off)",NoLita,New York,36 Ratings,https://www.groupon.com/deals/z-club-ny-2-4
"Local,Food & Drink,Cafes & Treats,Coffee Shops","What You'll Get,The Deal,How to use this deal:,Claim this deal by linking it to your eligible credit cards,Pay for qualifying purchases at the merchant with a linked card,Get 30% cash back on your first purchase and 10% cash back on additional purchases, including if the deal is re-claimed,Cash back rewards will be credited to your card statement within a few days",Caffe Bene,"Pay Nothing to Claim,No Voucher to Present,1st Purchase 30% Cash Back,10% Cash Back After That",30% Cash Back at Caffe Bene  NY,Midtown Manhattan,New York,164 Ratings,https://www.groupon.com/deals/caffe-bene-ny
"Local,Beauty & Spas,Hair & Styling,Color & Highlights","What You'll Get,Choice of:,Haircut, Blow-Dry, Style, and Conditioning,Haircut, Blow-Dry, Style, and Conditioning with Partial Highlights,Haircut, Blow-Dry, Style, and Conditioning with Single-Process Color,Haircut, Blow-Dry, Style, and Conditioning with Full Highlights,See Vada Spa’s other deals:,Shellac mani-pedis,Swedish massage packages,Chocolate Brazilian waxes,VelaShape III treatments,Tattoo removal,Nonsurgical fat-reduction treatments",Vada Spa,"Limited Time Remaining!,300+ viewed today,3,554 Ratings",Haircuts and Styling at Vada Spa (Up to 61% Off). Four Options Available.,Downtown Manhattan,New York,"3,554 Ratings",https://www.groupon.com/deals/vada-spa-4-10
"Local,Things To Do,Sightseeing & Tours,Bus Tours","What You'll Get,Choose Between Options,$34 for a New York City tour package for one ($64 value),$60 for a New York City tour package for two ($128 value),Each tour package includes the following for each person:,Unlimited 24-hour access to the following hop-on, hop-off bus tours; please consult tour schedule for hours:,Downtown bus tour,Uptown bus tour,Brooklyn bus tour,Night tour,Free Admission to the Museum of the City of New York,Free two-hour bike rental with any bike rental purchase,Free New York bagel breakfast at the Museum of the City of New York,Double-decker buses travel continuously around a loop that passes points of interest. Automated narration plays throughout, and guests can get off for a closer look and then catch the next bus to continue the tour.,For schedule and hours, see,here,for more information.",TopView Sightseeing,"Limited Time Remaining!,50+ bought today,1,670 Ratings","Hop-On, Hop-Off Bus Tours, Museum Visit, and Bike Rentals for One or Two from TopView Sightseeing -Up to $68 Off",TopView Visitor Center at Bike Rental Central Park,New York,"1,670 Ratings",https://www.groupon.com/deals/go-new-york-tours-2
"Local,Things To Do,Sightseeing & Tours,Museums","What You'll Get,Choice of:,Standard Admission for One Adult or Child,Superhero Admission for One Adult or Child",Madame Tussauds NYC,"Limited Time Remaining!,100+ bought today,2,609 Ratings",Standard or Superhero Admission for One Adult or Child to Madame Tussauds NYC (Up to 29% Off),Times Square NYC,New York,"2,609 Ratings",https://www.groupon.com/deals/madame-tussauds-nyc-29
"Local,Health & Fitness,Gyms,Fitness Classes","What You'll Get,Choose Between Two Options,$19.50 for Three Kickboxing Classes of Choice and One Pair of Gloves ($95 value),$50 for Two Consecutive Weeks of Classes and One Pair of Gloves ($119 value)",CKO Hoboken Madison,"Limited Time Remaining!,30+ viewed today,384 Ratings",Three Classes or Two Weeks of Kickboxing Classes at CKO Hoboken Madison (Up to 79% Off),Hoboken,New York,384 Ratings,https://www.groupon.com/deals/cko-hoboken-madison
"Local,Beauty & Spas,Spas,Day Spas","What You'll Get,Choice of:,Spa Day Pass for One,Spa Day Pass for Two,Includes access to the steam room, sauna, hot tub, and showers (with separate male and female areas). Visitors can also access the rooftop, resting areas, and use basic gym equipment. Snacks, coffee, and purified water are included; does not include massage services or other drinks.",99 Health Club,"Limited Time Remaining!,800+ viewed today,118 Ratings",Spa Day Pass for One or Two at 99 Health Club (Up to 44% Off),Brooklyn,New York,118 Ratings,https://www.groupon.com/deals/99-health-club
"Local,Things To Do,Kids Activities,Kids Sports","What You'll Get,Choose Between Two Options,$46.50 for 90 minutes of bowling on one lane for up to five people, with shoe rental ($95 value),$20 for 90 minutes of bowling on one lane for up to two people, with shoe rental ($38 value),Must be finished before 5 P.M. on weekdays and 7 P.M. on weekends.",Astoria Bowl,"Limited Time Remaining!,200+ viewed today,867 Ratings",90 Minutes of Bowling on a Single Lane for Two or Five with Shoe Rental at Astoria Bowl (Up to 51% Off),Ditmars Steinway,New York,867 Ratings,https://www.groupon.com/deals/astoria-bowl-1
"Local,Beauty & Spas,Hair Removal,Bikini Wax","What You'll Get,Choose Between Two Options,$20 for one chocolate Brazilian wax or full leg wax ($40 value),$39 for two chocolate Brazilian waxes or full leg waxes ($80 value),Below the Belt: Choosing Between a Brazilian and a Bikini Wax,The difference between a bikini and Brazilian wax is simple yet significant. Check out our guide to help you choose the right one for you.,Both waxing styles involve using hot wax to remove hair from the area below the waist, but the distinction lies in the degree of hair being removed. During a basic bikini wax, an aesthetician removes hair from any area exposed by a typical bathing suit made of fig leaves. This includes the top and sides of the bikini line as well as the inner thighs, if necessary. The Brazilian wax takes it a step further, removing hair from the entire region, front to back. Since many clients prefer to leave a small, trimmed swath of hair in a strip or triangle just below the panty line, some aestheticians may use the term “full Brazilian” to refer to a session in which no hair is left behind.,Naturally, due to the sensitivity of the areas involved, Brazilians tend to be more painful than basic bikini waxes, and most aestheticians will take care to avoid causing pain during the procedure. There are also several steps you can take to minimize discomfort. Experts recommend avoiding any appointment within a week of menstruation, when the skin is most sensitive, and taking an anti-inflammatory such as ibuprofen 30 minutes beforehand can help reduce any swelling that results.",Blossom Brows Threading Salon,"Limited Time Remaining!,40+ viewed today,370 Ratings",One or Two Brazilian Waxes at Blossom Brows Threading Salon (Up to 51% Off),Upper East Side,New York,370 Ratings,https://www.groupon.com/deals/blossom-brows-threading-salon
"Local,Things To Do,Kids Activities,Trampoline & Bounce Houses","What You'll Get,Choice of:,Single-Day Open Play Pass,Three vouchers: Each Good for Single-Day Open Play Pass,Click,here,to view the summer camp offer.",Curiosity on Court,"Limited Time Remaining!,150+ viewed today,134 Ratings",One or Three Single-Day Open Play Passes at Curiosity on Court (Up to 46% Off),Cobble Hill,New York,134 Ratings,https://www.groupon.com/deals/curiosity-on-court
"Local,Food & Drink,Restaurants,Pizza","What You'll Get,Choice of:,$30 Worth of Food and Drinks (Valid Sunday - Thursday),$30 Worth of Food and Drinks (Valid on Any Day),See the,menu",Numero 28,"Limited Time Remaining!,Selling fast!,225 Ratings",Italian Cuisine at Numero 28 (Up to 50% Off). Two Options Available.,East Village,New York,225 Ratings,https://www.groupon.com/deals/numero-28-1
"Local,Health & Fitness,Gyms,Fitness Classes","What You'll Get,Choice of:,Three Kickboxing Classes,Six Kickboxing Classes,Three Things to Know About Kickboxing,Kickboxing is a popular form of competitive fighting, but it really encompasses many different combat disciplines. Read on to learn more about this martial arts—and fitness—mainstay.,1. Kickboxing is many disciplines in one, incorporating moves and techniques from many martial arts.,Punches, kicks, elbows, clinches, and takedowns are all fair game. As such, styles can vary widely among martial-arts purists, boxers, and fighters who work to cultivate a unique approach.,2. Its versatility translates well to fitness.,Kickboxing balances upper- and lower-body flexibility with cardiovascular exercise, making for an effective full-body workout. Practitioners also get the benefit of learning self-defense techniques, getting a leg up on their peers who only know how to chuck a treadmill at an attacker.,3. It’s not that old.,Kickboxing is quite popular in Thailand, which is also home to Muay Thai—a form of boxing, practiced as a regulated sport since the late 19th century, in which fighters don gloves and other pads. In 1966, a Japanese karate promoter became infatuated with Muay Thai—and particularly the full-contact striking that’s not allowed in karate—and saw an opportunity to blend the styles. He prepared three karate fighters to take on Muay Thai specialists, and the competition was fierce enough to inspire the birth, a few years later, of kickboxing as an organized sport.",CKO Kickboxing Gramercy,"Limited Time Remaining!,100+ viewed today,103 Ratings",Three or Six Kickboxing Classes at CKO Kickboxing Gramercy (Up to 79%  Off),Midtown Manhattan,New York,103 Ratings,https://www.groupon.com/deals/cko-kickboxing-gramercy
"Local,Health & Fitness,Gyms,Fitness Classes","What You'll Get,The more exciting an exercise class is, the more likely you are to stick with it, which explains why smooth jazzercise never caught on. Kick it up a notch with this voucher.,Choose Between Two Options,$39 for one month off unlimited,women’s kickboxing classes,($120 value),$69 for two months off unlimited women’s kickboxing classes ($240 value)",Hip + Fit,"Limited Time Remaining!,100+ viewed today,398 Ratings",One or Two Months of Unlimited Women’s Kickboxing Fitness Classes at Hip + Fit (Up to 71% Off),Multiple Locations,New York,398 Ratings,https://www.groupon.com/deals/hip-fit-1
"Local,Things To Do,Kids Activities,Mini Golf","What You'll Get,Choice of:,Three Rounds of Indoor Glow Golf for Two,Three Rounds of Indoor Glow Golf for Four,Three Rounds of Indoor Glow Golf for Six,Three Rounds of Indoor Glow Golf and One Laser Maze Challenge for Two",Glowgolf,"Limited Time Remaining!,250+ viewed today,4,977 Ratings","Three Rounds of Indoor Glow Golf for Two, Four, or Six at  Glowgolf (Up to 54% Off)",Roosevelt Field Mall,New York,"4,977 Ratings",https://www.groupon.com/deals/glowgolf-other-tin-17
"Local,Things To Do,Sightseeing & Tours,Museums","What You'll Get,Choice of:,Two General Admission Tickets,Four General Admission Tickets",9/11 Tribute Museum,"Limited Time Remaining!,100+ bought today,2,343 Ratings",Two or Four Tickets to the 9/11 Tribute Museum (Up to 30% Off),Financial District,New York,"2,343 Ratings",https://www.groupon.com/deals/9-11-tribute-museum
"Local,Beauty & Spas,Blowouts & Styling,Blowouts","What You'll Get,Choose from Four Options,$16.99 for one blowout ($40 value),$24 for one blowout and one brow thread ($48 value),$39 for two blowouts ($80 value),$45 for two blowouts and two brow threads ($96 value)<p>",Classic Brows,"Limited Time Remaining!,50+ viewed today,642 Ratings",One or Two Blowouts with Optional Eyebrow Threading at  Classic Brows (Up to 58% Off),Classic Brows,New York,642 Ratings,https://www.groupon.com/deals/classic-brows-1
"Local,Beauty & Spas,Massage,Foot Massage","What You'll Get,One 60-Minute Foot Reflexology Session",Yan Foot Spa,"Limited Time Remaining!,100+ viewed today,123 Ratings",One 60-Minute Reflexology Session at Yan Foot Spa ($35 Value),SoHo,New York,123 Ratings,https://www.groupon.com/deals/yan-foot-spa
"Local,Health & Fitness,Natural Medicine","What You'll Get,Choice of:,One Ear Candling Treatment,Two Ear Candling Treatments,Three Ear Candling Treatments",You and Her Spa,"Limited Time Remaining!,Up to 50% Off,11 Ratings","One, Two, or Three Ear Candling Treatments at You and Her Spa (Up to 50% Off)",Chinatown,New York,11 Ratings,https://www.groupon.com/deals/you-and-her-spa-2
"Local,Beauty & Spas,Salons,Tanning Salons","What You'll Get,Choose from Three Options,$22 for one,spray booth tan,($35 value),$39 for two spray booth tans or one,custom airbrush tan,($75 value),$69 for two custom airbrush tans ($150 value)",Bronze Boutique & Spa,"Limited Time Remaining!,60+ viewed today,387 Ratings",One or Two Spray Booth Tans or Custom Airbrush Tans at Bronze Boutique & Spa (Up to 54% Off),Upper East Side,New York,387 Ratings,https://www.groupon.com/deals/bronze-boutique-spa
"Local,Food & Drink,Restaurants,American Restaurants","What You'll Get,The Deal,How to use this deal:,Claim this deal by linking it to your eligible credit cards,Pay for qualifying purchases at the merchant with a linked card,Get 25% cash back on your first purchase and 15% cash back on additional purchases, including if the deal is re-claimed,Cash back rewards will be credited to your card statement within a few days",Penthouse 808,"Pay Nothing to Claim,No Voucher to Present,1st Purchase 25% Cash Back,15% Cash Back After That",25% Cash Back at Penthouse 808,Long Island City,New York,"2,399 Ratings",https://www.groupon.com/deals/penthouse-808-25839521
"Local,Food & Drink,Restaurants,Indian Restaurants","What You'll Get,Choose Between Two Options,$25 for an Indian dinner for two (up to $55 value),$45 for an Indian dinner for four (up to $110 value),Each pair receives:,One appetizer,One order of naan,Two entrees,One order of basmati rice,One dessert,Two glasses of wine,See the,full dine-in menu",Indigo Indian Bistro,"Limited Time Remaining!,150+ viewed today,1,649 Ratings","Three-Course Dinner with Appetizers, Desserts, and Wine for Two or Four at Indigo Indian Bistro (Up to 59% Off)",Midtown East,New York,"1,649 Ratings",https://www.groupon.com/deals/indigo-indian-bistro-3
"Local,Beauty & Spas,Face & Skin Care,Facial","What You'll Get,Choice of:,One Microdermabrasion Treatment,Two Microdermabrasion Treatments,Four Microdermabrasion Treatments,Six Microdermabrasion Treatments",Face + Body by Dorit Baxter,"Limited Time Remaining!,70+ viewed today,241 Ratings","One, Two, Four, or Six Microdermabrasion Treatments at Face + Body by Dorit Baxter (Up to 81% Off)",Upper East Side,New York,241 Ratings,https://www.groupon.com/deals/face-body-by-dorit-baxter-3
