categories,deal_features,merchant,mini_info,promotion_title,rel_location,state,total_ratings,url
"Local,Health & Fitness,Natural Medicine,Acupuncture","What You'll Get,Choose Between Two Options,$24 for one acupuncture session ($49 value),$47 for two acupuncture sessions ($98 value),Acupuncture and Acupressure: Hitting the Spots,Acupuncture and its sister treatment, acupressure, have endured for centuries. Peruse our exploration of acupoint therapy to pinpoint the facts on these ancient techniques.,Despite their different names, acupuncture and acupressure rely on the same principle: the stimulation of the body to trigger natural processes. During typical treatments, licensed acupuncturists target specific bodily points by applying pressure with their hands or a dull implement (in acupressure) or inserting fine needles (for acupuncture). These points correspond to meridians, which, according to the practice’s underlying philosophy, are channels that transport life-giving energy throughout the body. By stimulating the meridians, the acupuncturist releases any blockers to this energy flow and restores the body to health.,Compared to the constantly evolving field of modern medicine, acupuncture has remained essentially unchanged for millennia. Evidence suggests that the treatment existed as far back as 5,000 years ago—the preserved mummy Ötzi the Iceman, for example, bears tattoos that correspond to classical acupuncture points. While contemporary scientific understanding has cast a new light on the body’s inner workings, acupuncture remains a popular procedure with mainstream credibility: a 2002 World Health Organization report found that acupuncture can be an effective treatment for conditions ranging from gout to certain respiratory disorders and acknowledged that “its effective rate in the treatment of chronic pain is comparable with that of morphine.”",City Acupuncture - East Village,"Limited Time Remaining!,50+ viewed today,152 Ratings",One or Two Acupuncture Sessions at City Acupuncture - East Village (Up to 52% Off),Alphabet City,New York,152 Ratings,https://www.groupon.com/deals/city-acupuncture-east-village
"Local,Automotive,Auto Repair & Maintenance,Oil Change","What You'll Get,Choose from Three Options,$24.99 for a conventional oil change ($35.99 value),$38.99 for a synthetic-blend oil change ($59.99 value),$54.99 for a full synthetic oil change ($79.99 value),A 15-minute,oil change,includes up to 5 quarts of oil, a new filter, and a maintenance check. Plus, Groupon customers will receive 15% off select preventive maintenance services.,Valvoline Instant Oil Change,With lube and service centers spread across America, Valvoline Instant Oil Change ensures that roads from coast to coast teem with automotive vigor. Certified technicians perform a roster of services, including quick in-and-out oil changes that allow motorists to arrive without an appointment and remain in their car while Valvoline oils forge a truce between metal parts. Facilities also encourage odometers to reach up to 300,000 miles with an engine-guarantee program that helps motors live long enough to see tow trucks go extinct.",Valvoline Instant Oil Change - Galena Associates,"Limited Time Remaining!,150+ viewed today,20,195 Ratings","Conventional, Synthetic Blend, or Full Synthetic Oil Change at Valvoline Instant Oil Change (Up to a $79.99 Value)",Multiple Locations,New York,"20,195 Ratings",https://www.groupon.com/deals/valvoline-instant-oil-change-47-new-york
"Local,Things To Do,Fun & Leisure,Escape Games","What You'll Get,After purchasing this deal, you will need to visit the website listed on your voucher to complete redemption.,Choose from Three Options,$27 for escape game for one ($38 value),$49 for escape game for two ($76 value),$89 for escape game for four ($152 value)",Riddle Me Out,"Limited Time Remaining!,Selling fast!,1,429 Ratings","High-Tech Escape Game for One, Two, or Four at Riddle Me Out (Up to 41% Off)",Riddle Me Out,New York,"1,429 Ratings",https://www.groupon.com/deals/riddle-me-out
"Local,Beauty & Spas,Salons,Tanning Salons","What You'll Get,Choice of:,One Airbrush Tanning Session,Two Mystic HD Spray Tanning Sessions,One Month of Unlimited Tanning in Any Bed",NY Sun Club ,"Limited Time Remaining!,100+ viewed today,343 Ratings",One Airbrush or Two Mystic HD Tanning Sessions or One Month of Unlimited Tanning at NY Sun Club (Up to 71% Off),Midtown Manhattan,New York,343 Ratings,https://www.groupon.com/deals/ny-sun-club-murray-hill-6
"Local,Things To Do,Nightlife,Movies","What You'll Get,Choose Between Two Options,A Drive-in Movie Package For Two Adults,Two adult tickets for a double feature,Two popcorns,A Drive-in Movie Package For A Family Of Four,Two adult tickets and two kids’ (ages 4-11) tickets for a double feature,Four popcorns,Please note: From May 1st to September 4th, the Groupon cannot be used on Fridays, Saturdays, and Sundays.",Warwick Drive-In Theatre,"Limited Time Remaining!,700+ viewed today,1,084 Ratings",Drive-In Double Feature with Popcorn for Two Adults or Family of Four at Warwick Drive-In Theatre(Up to 37% Off),Warwick Drive-In Theatre,New York,"1,084 Ratings",https://www.groupon.com/deals/warwick-drive-in-theatre-1
"Local,Food & Drink,Restaurants,Indian Restaurants","What You'll Get,Choose Between Two Options,$17.50 for $35 worth of Indian fusion for two,$36.50 for $50 worth of Indian fusion for four",Mausam Indian Cuisine,"Limited Time Remaining!,Up to 50% Off,640 Ratings",Indian Fusion for Two or Four at Mausam Indian Cuisine (Up to 50% Off),Mausam Indian Cuisine,New York,640 Ratings,https://www.groupon.com/deals/mausam
"Local,Beauty & Spas,Massage,Full Body Massage","What You'll Get,Choose Between Two Options,$35 for a consultation and a,massage,($220 value),$29 for a consultation and an,acupuncture session,($150 value)",Manhattan Total Health,"Limited Time Remaining!,100+ viewed today,180 Ratings",Consultation and Massage or Acupuncture Session at Manhattan Total Health (Up to 84% Off),Multiple Locations,New York,180 Ratings,https://www.groupon.com/deals/manhattan-total-health
"Local,Health & Fitness,Gyms,Health Clubs","What You'll Get,Choice of:,Three Krav Maga Classes,Six Krav Maga Classes,One Month of Unlimited Krav Maga Classes",Krav Maga Academy,"Limited Time Remaining!,Up to 50% Off,32 Ratings",Three or Six Classes or One-Month Membership at Krav Maga Academy (Up to 50%Off),Midtown Manhattan,New York,32 Ratings,https://www.groupon.com/deals/krav-maga-academy-3-7
"Local,Food & Drink,Restaurants,Pizza","What You'll Get,Choose Between Two Options,$12 for three slices and one soda, beer, or wine ($20.50 value),$32 for one pizza and four sodas, beers, or wine ($57 value),Click to see the menu",Artichoke Basille's Pizza,"Limited Time Remaining!,200+ viewed today,835 Ratings","Three Slices or One Pizza with Sodas, Beers, or Wine at Artichoke Basille's Pizza (Up to 44% Off)",Astoria,New York,835 Ratings,https://www.groupon.com/deals/artichoke-basille-s-pizza-astoria-1
"Local,Health & Fitness,Gyms,Fitness Classes","What You'll Get,Good posture makes you seem taller and more confident, just like standing on the shoulders of your arch nemesis. Show them who’s boss with this voucher.,The Deal,$35 for 5 Awareness Through Movement classes (a $125 value),Students divide their time between lying on cotton mats, sitting in chairs, and standing during classes designed to reintroduce the nervous system to the movement-related learning humans do as infants. The sessions can minimize unneeded muscle strain, improve posture, and aid in injury recovery. New students are strongly encouraged to attend basic classes. For more information, see the,class description and schedule,and,FAQs",Feldenkrais Institute of NY,"Limited Time Remaining!,20+ viewed today,358 Ratings",$35 for 5 Movement-Therapy Classes at The Feldenkrais Institute ($125 Value),Chelsea,New York,358 Ratings,https://www.groupon.com/deals/feldenkrais-institute-1
"Local,Food & Drink,Restaurants,Bar Food","What You'll Get,Billiards are a good way to burn time you would have otherwise spent staring into space or teaching your children manners. Get busy with this voucher.,Choose Between Two Options,$20 for one shared appetizer, one pitcher of domestic beer, and one hour of pool for two, valid Sunday–Thursday (a $40 value),$40 for two shared appetizers, one pitcher of domestic beer, and one hour of pool for four, valid Sunday–Thursday (an $80 value),See the,menu",Break Bar & Billiards,"Limited Time Remaining!,40+ viewed today,562 Ratings","Appetizers, Beer, and Pool for Two or Four at Break Bar & Billiards (50% Off)",Astoria,New York,562 Ratings,https://www.groupon.com/deals/break-bar-billiards
"Local,Food & Drink,Restaurants,Vegetarian Restaurants","What You'll Get,The Deal,How to use this deal:,Claim this deal by linking it to your eligible credit cards,Pay for qualifying purchases at the merchant with a linked card,Get 20% cash back on your first purchase and 10% cash back on additional purchases, including if the deal is re-claimed,Cash back rewards will be credited to your card statement within a few days",Royal Siam Thai Cuisine,"1st Purchase 20% Cash Back,10% Cash Back After That,No Voucher to Present,637 Ratings",20% Cash Back at Royal Siam Thai Cuisine,Anago Sushi,New York,637 Ratings,https://www.groupon.com/deals/anago-sushi
"Local,Health & Fitness,Dental,Teeth Whitening","What You'll Get,Choose Between Two Options,$109 for one,Zoom!,whitening treatment (a $699 value),$209 for two Zoom! whitening treatments (a $1,398 value),The in-office Zoom! treatment takes about one hour and can whiten teeth up to 10 shades. A layer of especially potent whitening elixir, freshly squeezed from ripe supernovas, cloaks enamel during the in-office procedure before a glowing plasma light activates the solution. For answers to frequently asked whitening questions, click,here,. The two Zoom! whitening treatments option can be used by one client twice or once by two individuals.",Smiles NYC,"Limited Time Remaining!,Selling fast!,1,589 Ratings",One or Two Zoom! Teeth Whitening Treatments at Smiles NYC (Up to 85% Off),Multiple Locations,New York,"1,589 Ratings",https://www.groupon.com/deals/dr-jacquie-smiles-2
"Local,Food & Drink,Restaurants,Middle Eastern Restaurants","What You'll Get,The Deal,How to use this deal:,Claim this deal by linking it to your eligible credit cards,Pay for qualifying purchases at the merchant with a linked card,Get 35% cash back on your first purchase and 15% cash back on additional purchases, including if the deal is re-claimed,Cash back rewards will be credited to your card statement within a few days",Simit Sarayi,"Pay Nothing to Claim,No Voucher to Present,1st Purchase 35% Cash Back,15% Cash Back After That",35% Cash Back at Simit Sarayi,Midtown Manhattan,New York,9 Ratings,https://www.groupon.com/deals/simit-sarayi
"Local,Food & Drink","What You'll Get,Choose Between Two Options,$18 for a package for two, including a flight of four beers each and one appetizer ($32 value),$35 for a package for two, including a flight of four beers each and two appetizers ($64 value)",Yonkers Brewing Co.,"Limited Time Remaining!,80+ viewed today,790 Ratings",Brewery Package for Two or Four with Beer Flights and Appetizers at Yonkers Brewing Co. (Up to 45% Off),Downtown Yonkers,New York,790 Ratings,https://www.groupon.com/deals/yonkers-brewing-co-new-york
"Local,Beauty & Spas,Brows & Lashes,Eyelash Extensions","What You'll Get,Choose From Three Options,$49 for Full set of dramatic eyelash (90 pieces),$59 for Full set of mink eyelash (120 pieces),$79 for Full set of mink eyelash (160 pieces)",Pro Skincare & Day Spa Inc,"Limited Time Remaining!,40+ viewed today,703 Ratings",Up to 63% Off 90-160 piece Eyelash Extensions at Pro Skincare & Day Spa Inc,New York,New York,703 Ratings,https://www.groupon.com/deals/pro-skincare-day-spa-inc
"Local,Beauty & Spas,Face & Skin Care,Facial","What You'll Get,Deep Cleansing Facials,$49 for one ($120 value),$143 for three ($360 value)",Bioxage,"Limited Time Remaining!,30+ viewed today,248 Ratings",One or Three Deep Cleansing Facials at Bioxage (Up to 60% Off),Midtown Center,New York,248 Ratings,https://www.groupon.com/deals/bioxage-3
"Local,Health & Fitness,Gyms,Fitness Classes","What You'll Get,Choice of:,Three Kickboxing Classes with Gloves,Six Kickboxing Classes with Gloves",CKO Kickboxing,"Limited Time Remaining!,80+ viewed today,111 Ratings",Three or Six Kickboxing Classes with Gloves at CKO Kickboxing (Up to 78% Off),Jersey City,New York,111 Ratings,https://www.groupon.com/deals/cko-kickboxing-jersey-city-1
"Local,Food & Drink,Restaurants","What You'll Get,Choice of:,$40 Value for Two or More,$80 Value for Four or More",The Bistro,"Limited Time Remaining!,50+ viewed today,91 Ratings",Italian Cuisine at The Bistro (Up to 35% Off),Harsimus,New York,91 Ratings,https://www.groupon.com/deals/bistro-21-717734280
"Local,Health & Fitness,Gyms,Zumba","What You'll Get,Choose from Three Options,$75 for 10 Zumba classes ($150 value),$39 for 5 Zumba classes ($85 value),$19 for 3 Zumba classes ($60 value)",Zumba Firecracker,"Limited Time Remaining!,Up to 68% Off,44 Ratings","3, 5, or 10 Zumba Classes at Zumba Firecracker (Up to 68% Off)",Dance Sport,New York,44 Ratings,https://www.groupon.com/deals/zumba-firecracker-1
"Local,Health & Fitness,Dental,Dentist","What You'll Get,The Deal,$49 for a dental exam with x-rays and cleaning ($330 value),X-rays limited to four PAs and two bite wings.","New York Dental Office, PC","Limited Time Remaining!,30+ viewed today,150 Ratings","$49 for a Dental Exam with X-Rays and Cleaning at New York Dental Office, PC ($330 Value)",Midtown South Central,New York,150 Ratings,https://www.groupon.com/deals/new-york-dental-office-pc-1-1
"Local,Beauty & Spas,Hair Removal,Laser Hair Removal,Small,Underarms,Lip,Extended Chin,Sideburns,Abdomen trail,Feet,Hands (including fingers),Knees,Back of the neck,Front of the neck,Shoulders,Areolas,Bikini line (panty line region),Inner buttocks,Large,Half arms,Lower back (waistline only),Full butt (excluding inner buttocks),Brazilian or Mankini (excluding inner buttocks and extended bikini line),Full face (including lip, chin, cheeks, jawline, and sideburns)","What You'll Get,Choose Between Two Options,$95 for one year of unlimited laser hair removal on one small area,$195 for one year of unlimited laser hair removal on one small area and one large area ($3,600 value),$299 for one year of unlimited laser hair removal treatments on one large and two small areas ($4,500 value),See the treatment areas,here", Infinity Laser Spa,"Limited Time Remaining!,500+ viewed today,606 Ratings",One Year of Unlimited Laser Hair Removal on Small and Large Areas at Infinity Laser Spa (Up to 95% Off),Infinity Laser Spa,New York,606 Ratings,https://www.groupon.com/deals/infinity-laser-spa-1
"Local,Beauty & Spas,Salons,Hair Salons","What You'll Get,Choice of:,Haircut and Blowdry,Single Process Color, Hair Cut, Shampoo, Deep Conditioning, and Blowout,Half Head of Highlights, Hair Cut, Shampoo, Deep Conditioning, and Blowout",Davidov Hair and Spa,"Limited Time Remaining!,30+ viewed today,772 Ratings",Hair Packages at Davidov Hair and Spa (Up to 65% Off ). Three Options Available.,Midtown Manhattan,New York,772 Ratings,https://www.groupon.com/deals/davidov-hair-and-spa-2-5
"Local,Beauty & Spas,Brows & Lashes,Eyelash Extensions","What You'll Get,One Full Set of Eyelash Extensions,Working hours:,11:00 am - 8:00 pm,Monday - Saturday",Blink Lash Club,"Limited Time Remaining!,20+ viewed today,65 Ratings",One Full Set of Eyelash Extensions at Blink Lash Club (56% Off),Midtown Manhattan,New York,65 Ratings,https://www.groupon.com/deals/blink-lash-club-1
"Local,Things To Do,Nightlife,Comedy Clubs","What You'll Get,There are many classic comedy routines, but none is more lauded than the one in which someone walks toward a banana peel and places it in the garbage. Enjoy throwaway gags with this voucherLive deal.,Choose from Four Options,$4 for Two General Admission Tickets to a Comedy Show ($50 value),$6 for Four General Admission Tickets to a Comedy Show ($100 value),$5 for Three General Admission Tickets to a Comedy Show ($75 value),$19 for Two General Admission Tickets to a Comedy Show, Two Drinks, and Two Tickets to a Future Show ($124 value),For the last option, every person is required to purchase at least one additional drink each at their initial show, and at least two additional drinks at their future show. For all other options, every person is required to purchase at least two drinks.,Tribeca Comedy Lounge,Renowned comedians descend from the summits of stardom to transform Tribeca Comedy Lounge into an uproarious sea of laughter. Recently named “Best New Comedy Club” by,Time Out New York,, the Lounge welcomes to its stage accomplished jokesters who have graced the spotlights of,Conan,,,Last Comic Standing,, and HBO.,Featured comics,include Keith Alberstadt, who’s appeared on,Late Show with David Letterman,multiple times, Sheng Wang, star of his own,Comedy Central Presents,special, and Sara Schaefer, star of MTV’s,The Nikki and Sara Show,. Guests may complement giggles with selections from an extensive wine list or entrees from a roster of award-winning Italian dishes, all available for purchase while attending a show.",Tribeca Comedy Lounge,"Limited Time Remaining!,200+ viewed today,782 Ratings",General Admission to Comedy Show at Tribeca Comedy Lounge (Up to 94% Off). Four Options Available.,Tribeca Comedy Lounge,New York,782 Ratings,https://www.groupon.com/deals/tribeca-comedy-lounge-2
"Local,Beauty & Spas,Hair & Styling,Hair Straightening","What You'll Get,Choice of:,Haircut, blow dry, and mask treatment,Set of balayage highlights and a blow dry,Organic Cezanne keratin hair-smoothing treatment,Partial highlights and a blow dry,Full highlights and a blow dry",ValEl Salon and Spa,"Limited Time Remaining!,100+ viewed today,1,709 Ratings","Haircut or Highlights Package, Balayage Highlights, or Cezanne Keratin Treatment at Val El Salon and Spa",Upper East Side,New York,"1,709 Ratings",https://www.groupon.com/deals/val-el-salon-and-spa-10
"Local,Beauty & Spas,Massage,Hot Stone Massage","What You'll Get,Choose Between Two Options,$45 for one 60-minute hot-stone massage ($78 value),$85 for two 60-minute hot-stone massages ($156 value)",Eastern Health Connection Plus,"Limited Time Remaining!,10+ viewed today,255 Ratings",One or Two 60-Minute Hot-Stone Massages at Eastern Health Connection Plus (Up to 46% Off),Eastern Health Connection Plus INC.,New York,255 Ratings,https://www.groupon.com/deals/eastern-health-connection-plus-inc-1
"Local,Beauty & Spas,Salons,Hair Salons","What You'll Get,Choice of:,Shampoo, Deep Heat Conditioning Treatment, Hair Dry, Cut, and Style,Shampoo, Deep Heat Conditioning Treatment, Cut, Style, and Root Color,Shampoo, Deep Heat Conditioning Treatment, Cut, Style, and Partial Highlights,Shampoo, Deep Heat Conditioning Treatment, Cut, Style, and Full Highlights,Full vs. Partial Highlights: Exploring New Dimension,Highlights can add dimension to an existing style or double the transformative effect of a new one. Read our guide of the process to prepare for your trip to the salon.,A skilled stylist doesn’t need a pair of scissors to transform a hairdo. The precise application of highlights—which isolate select strands of hair and treat them with a color, lightener, or toner—can become the basis for a brand new look without a single snip or shear. Before entering the salon, however, a client has to decide how much of the hair to highlight. Applied evenly throughout the entire head, full highlights create a natural look that mimics the way hair changes color over time in the sun, adding a sense of dimension and texture to the existing hair. Partial highlights, which are typically cheaper and take less time to apply, serve an altogether different purpose: drawing attention to specific features, such as bangs or newly sharpened antlers, by accenting only the locks on the surface. As a result, partial highlights are somewhat less flexible—losing their effect, for example, when putting your hair up or teasing it out.",Glamour Center Hair Salon,"Limited Time Remaining!,30+ viewed today,10 Ratings",Hair Styling Packages at Glamour Center Hair Salon (Up to 54% Off). Four Options Available.,Midtown Manhattan,New York,10 Ratings,https://www.groupon.com/deals/glamour-center-hair-salon-1
"Local,Beauty & Spas,Face & Skin Care,Facial","What You'll Get,A Chat with Aquamarine Spa,What services does your business offer and what makes your business stand out from the competition?,Deep cleansing facial with scalp massage. Facial includes neck, shoulder, and decollete massage to help you get away from busy city life. We would love to find your own beauty. Our goal is…Your brighter skin and brighter smile.,What was the inspiration to start or run this business?,To see people’s big smiles and great skin.",Aquamarine Spa,"Limited Time Remaining!,10+ viewed today,19 Ratings",A 75-Minute Mineral Deep-Cleansing Facial and Massage at Aquamarine Spa (55% Off),Aquamarine Spa,New York,19 Ratings,https://www.groupon.com/deals/aquamarine-spa
"Local,Beauty & Spas,Hair Removal,Laser Hair Removal,Small areas,areola,happy trail,ball of chin,ears,nose,forehead,fingers,toes,sideburns,upper lip,lower lip,underarms,inner buttocks,Medium areas:,bikini line,middle line,front or back of neck,inner thigh,front or back of men’s neckline,full feet and toes,full hands and fingers,Large areas:,women’s Brazilian bikini (inner buttocks is not included),women’s breasts,shoulder,full neck,men’s full neck,upper back,lower back,chest,abdomen,buttocks (not including inner area),upper arms,forearms","What You'll Get,Choice of:,Three Laser Hair-Removal Sessions On Small Area,Three Laser Hair-Removal Sessions On Medium Area,Three Laser Hair-Removal Sessions On Large Area,Six Laser Hair-Removal Sessions On Small Area,Six Laser Hair-Removal Sessions On Medium Area,Six Laser Hair-Removal Sessions On Large Area",Bared Monkey Laser Spa,"Limited Time Remaining!,200+ viewed today,502 Ratings",Laser Hair Removal at Bared Monkey Laser Spa (Up to 86% Off). Six Options Available.,Midtown Manhattan,New York,502 Ratings,https://www.groupon.com/deals/bared-monkey-laser-spa-8
"Local,Food & Drink,Restaurants,Asian Restaurants","What You'll Get,The Deal,How to use this deal:,Claim this deal by linking it to your eligible credit cards,Pay for qualifying purchases at the merchant with a linked card,Get 20% cash back on your first purchase and 10% cash back on additional purchases, including if the deal is re-claimed,Cash back rewards will be credited to your card statement within a few days",Bangkok2 Thai,"Pay Nothing to Claim,No Voucher to Present,1st Purchase 20% Cash Back,10% Cash Back After That",20% Cash Back at Bangkok2 Thai,Midtown Manhattan,New York,2 Ratings,https://www.groupon.com/deals/bangkok2-thai-3
"Local,Food & Drink,Restaurants,Italian Restaurants","What You'll Get,The Deal,$49 for $80 worth of food and drink,Click here to see the menu",Bocca,"Limited Time Remaining!,100+ viewed today,239 Ratings",Roman Cuisine at Bocca (39% Off),Midtown Manhattan,New York,239 Ratings,https://www.groupon.com/deals/bocca-1
"Local,Food & Drink,Cafes & Treats,Ice Cream","What You'll Get,The Deal,How to use this deal:,Claim this deal by linking it to your eligible credit cards,Pay for qualifying purchases at the merchant with a linked card,Cash back rewards will be credited to your card statement within a few days",Snow Face Shaved Cream,"Pay Nothing to Claim,No Voucher to Present,Use More than Once",20% Cash Back at Snow Face Shaved Cream,Hell's Kitchen,New York,50 Ratings,https://www.groupon.com/deals/snow-face-shaved-cream-1
"Local,Food & Drink,Restaurants,Mediterranean Restaurants","What You'll Get,The Deal,How to use this deal:,Claim this deal by linking it to your eligible credit cards,Pay for qualifying purchases at the merchant with a linked card,Get 20% cash back on your first purchase and 15% cash back on additional purchases, including if the deal is re-claimed,Cash back rewards will be credited to your card statement within a few days",Pita Grill,"Pay Nothing to Claim,No Voucher to Present,1st Purchase 20% Cash Back,15% Cash Back After That",20% Cash Back at Pita Grill,Midtown East,New York,6 Ratings,https://www.groupon.com/deals/pita-grill-2
